{
  "$schema": "http://json-schema.org/draft-07/schema#",
  "title": "Spell",
  "type": "object",
  "required": ["name", "level", "school", "castingTime", "range", "components", "duration", "description"],
  "properties": {
    "id": { "type": "string" },
    "name": { "type": "string" },
    "source": { "type": "string", "default": "5e SRD" },
    "level": { "type": "integer", "minimum": 0, "maximum": 9, "description": "0 = cantrip" },
    "school": { "type": "string", "enum": ["Abjuration", "Conjuration", "Divination", "Enchantment", "Evocation", "Illusion", "Necromancy", "Transmutation"] },
    "castingTime": { "type": "string" },
    "range": { "type": "string" },
    "components": { "type": "array", "items": { "type": "string" } },
    "duration": { "type": "string" },
    "description": { "type": "string" },
    "higherLevels": { "type": "string" },
    "classes": { "type": "array", "items": { "type": "string" } }
  }
}
